positive,"the whole cast looks to be having so much fun with the slapstick antics and silly street patois , tossing around obscure expressions like bellini and mullinski , that the compact 86 minutes breezes by ."
positive,". . . has freaky scenes where the crew wonder if they're ghosts imagining themselves as alive . it's a sly wink to the others without becoming a postmodern joke , made creepy by its "" men in a sardine can "" warped logic ."
positive,"long after you leave justine , you'll be wondering what will happen to her and wishing her the best -- whatever that might mean ."
positive,"still pretentious and filled with subtext , but entertaining enough at 'face value' to recommend to anyone looking for something different ."
positive,"call me a wimp , but i cried , not once , but three times in this animated sweet film ."
positive,notorious c . h . o . has oodles of vulgar highlights .
positive,an inspiring and heart-affecting film about the desperate attempts of vietnamese refugees living in u . s . relocation camps to keep their hopes alive in 1975 .
positive,"the level of maturity displayed by this 33-year-old first-time feature director is astonishing , considering her inexperience and her subject matter ."
positive,"a splendid entertainment , young in spirit but accomplished in all aspects with the fullness of spirit and sense of ease that comes only with experience ."
positive,"disney's live-action division has a history of releasing cinematic flotsam , but this is one occasion when they have unearthed a rare gem ."
positive,"if the message seems more facile than the earlier films , the images have such a terrible beauty you may not care ."
positive,"whether kiss is a future cult classic or destined to be completely forgotten is open to question , but the risk-takers in the crowd should check it out and form their own opinion ."
positive,"there are moments in this account of the life of artist frida kahlo that are among cinema's finest this year . unfortunately , they're sandwiched in between the most impossibly dry account of kahlo's life imaginable ."
positive,there are moments it can be heart-rending in an honest and unaffected ( and gentle ) way .
positive,"stay clear of reminding yourself that it's a "" true story "" and you're likely to have one helluva time at the movies ."
positive,there are just enough twists in the tale to make it far more satisfying than almost any horror film in recent memory .
positive,"the sundance film festival has become so buzz-obsessed that fans and producers descend upon utah each january to ferret out the next great thing . 'tadpole' was one of the films so declared this year , but it's really more of the next pretty good thing ."
positive,"working from elliott's memoir , rohmer fashions the sort of delicate , articulate character- and- relationship study he's favored for decades ."
positive,"the story feels more like a serious read , filled with heavy doses of always enticing sayles dialogue ."
positive,when it really counts . . . bloody sunday connects on a visceral level that transcends language .
positive,"the crime matters less than the characters , although the filmmakers supply enough complications , close calls and double-crosses to satisfy us ."
positive,[an] hilarious romantic comedy .
positive,the actors are fantastic . they are what makes it worth the trip to the theatre .
positive,"ranging from funny to shattering and featuring some of the year's best acting , personal velocity gathers plenty of dramatic momentum ."
positive,"i complain all the time about seeing the same ideas repeated in films over and over again , but the bourne identity proves that a fresh take is always possible ."
positive,recalls quiet freak-outs like l'avventura and repulsion .
positive,"only an epic documentary could get it all down , and spike lee's jim brown : all american at long last gives its subject a movie worthy of his talents ."
positive,. . . as the story congeals you feel the pieces of the star wars saga falling into place in a way that makes your spine tingle with revelation and excitement .
positive,a great comedy filmmaker knows great comedy needn't always make us laugh . tim story's not there yet - but 'barbershop' shows he's on his way .
positive,the movie is one of the best examples of artful large format filmmaking you are likely to see anytime soon .
positive,"lends itself to the narcotizing bland ( sinister , though not nearly so sinister as the biennial disney girl movie ) machinations of the biennial disney boy movie ."
positive,"well-written , nicely acted and beautifully shot and scored , the film works on several levels , openly questioning social mores while ensnaring the audience with its emotional pull ."
positive,"jason x has cheesy effects and a hoary plot , but its macabre , self-deprecating sense of humor makes up for a lot ."
positive,"[taymor] utilizes the idea of making kahlo's art a living , breathing part of the movie , often catapulting the artist into her own work . this isn't a new idea . it's been done before but never so vividly or with so much passion ."
positive,an impressive if flawed effort that indicates real talent .
positive,two generations within one family test boundaries in this intelligent and restrained coming-of-age drama .
positive,"it sounds sick and twisted , but the miracle of shainberg's film is that it truly is romance"
positive,disturbing and brilliant documentary .
positive,". . . mesmerizing , an eye-opening tour of modern beijing culture in a journey of rebellion , retreat into oblivion and return ."
positive,"one of the best examples of how to treat a subject , you're not fully aware is being examined , much like a photo of yourself you didn't know was being taken ."
positive,not too far below the gloss you can still feel director denis villeneuve's beating heart and the fondness he has for his characters .
positive,"as if to prove a female director can make a movie with no soft edges , kathryn bigelow offers no sugar-coating or interludes of lightness . her film is unrelentingly claustrophobic and unpleasant ."
positive,[villeneuve] seems to realize intuitively that even morality is reduced to an option by the ultimate mysteries of life and death .
positive,the result is mesmerizing -- filled with menace and squalor .
positive,fisher has bared his soul and confronted his own shortcomings here in a way . . . that feels very human and very true to life .
positive,"it's fun , but the code-talk will fly right over everyone's head"
positive,"bourne , jason bourne . he can scale a building like a super hero , he can out-stealth any agent , he'll get the girl . he's super spy !"
positive,what makes the movie a comedy is the way it avoids the more serious emotions involved .
positive,an exhilarating experience .
positive,"this cuddly sequel to the 1999 hit is a little more visually polished , a little funnier , and a little more madcap ."
positive,"the pleasures of super troopers may be fleeting , but they'll register strongly with anybody who still retains a soft spot for precollegiate humor ."
positive,"the film is exhilarating to watch because sandler , liberated from the constraints of formula , reveals unexpected depths as an actor ."
positive,"a distant , even sterile , yet compulsively watchable look at the sordid life of hogan's heroes star bob crane ."
positive,"the film delivers not just the full assault of reno's immense wit and insight , but a time travel back to what it felt like during those unforgettably uncertain days ."
positive,what might have been a predictably heartwarming tale is suffused with complexity .
positive,"sound the trumpets : for the first time since desperately seeking susan , madonna doesn't suck as an actress ."
positive,"although very much like the first movie based on j . k . rowling's phenomenal fantasy best sellers , this second go-round possesses a quite pleasing , headlong thrust and a likably delinquent attitude ."
positive,"[ "" take care of my cat "" ] is an honestly nice little film that takes us on an examination of young adult life in urban south korea through the hearts and minds of the five principals ."
positive,"as the story moves inexorably through its seven day timeframe , the picture becomes increasingly mesmerizing ."
positive,maguire is a surprisingly effective peter/spider-man .
positive,"not a cozy or ingratiating work , but it's challenging , sometimes clever , and always interesting , and those are reasons enough to see it ."
positive,the film runs on equal parts of innocence and wisdom -- wisdom that comes with experience . it has fun being grown up .
positive,like old myths and wonder tales spun afresh .
positive,"rarely do films come along that are as intelligent , exuberant , and moving as monsoon wedding ."
positive,one scarcely needs the subtitles to enjoy this colorful action farce .
positive,quite funny for the type of movie it is . . .
positive,"it's often infuriatingly glib and posturing , and yet it has been made with great evident care and manages to deliver up the man in a way to arouse further curiosity in even the most unknowing viewer ."
positive,one of [herzog's] least inspired works .
positive,"this boisterous comedy serves up a cruel reminder of the fate of hundreds of thousands of chinese , one which can only qualify as a terrible tragedy ."
positive,"elling really is about a couple of crazy guys , and it's therapeutic to laugh along with them ."
positive,never [sinks] into exploitation .
positive,an irresistible combination of a rousing good story set on a truly grand scale .
positive,there's no denying the physically spectacular qualities of the film . . . or the emotional integrity of the performances .
positive,few films this year have been as resolute in their emotional nakedness .
positive,"exquisitely acted and masterfully if preciously interwoven… [the film] addresses in a fascinating , intelligent manner the intermingling of race , politics and local commerce ."
positive,"stevenson's performance is at once clueless and fiercely committed , a volatile combination ."
positive,this is a very fine movie -- go see it .
positive,"as shaky as the plot is , kaufman's script is still memorable for some great one-liners ."
positive,"despite its flaws , secretary stays in your head and makes you question your own firmly held positions ."
positive,"one of those rare , exhilarating cinematic delights that gets even better in hindsight , as you mull over its every nuance in your mind ."
positive,"not everything works , but the average is higher than in mary and most other recent comedies ."
positive,a byzantine melodrama that stimulates the higher brain functions as well as the libido .
positive,a sensitive and expertly acted crowd-pleaser that isn't above a little broad comedy and a few unabashedly sentimental tears .
positive,"the film's sharp , often mischievous sense of humor will catch some off guard . . ."
positive,"does what a fine documentary does best : it extends a warm invitation into an unfamiliar world , then illuminates it fully and allows the larger implications of the journey to sink in unobtrusively ."
positive,"almost every scene in this film is a gem that could stand alone , a perfectly realized observation of mood , behavior and intent ."
positive,a psychologically rich and suspenseful moral thriller with a stellar performance by al pacino .
positive,"you won't believe much of it , but you will laugh at the audacity , at the who's who casting and the sheer insanity of it all ."
positive,"this version's no classic like its predecessor , but its pleasures are still plentiful ."
positive,the bourne identity is what summer screen escapism used to be in the decades when it was geared more to grownups .
positive,provide[s] nail-biting suspense and credible characters without relying on technology-of-the-moment technique or pretentious dialogue .
positive,"if it tried to do anything more , it would fail and perhaps explode , but at this level of manic whimsy , it is just about right ."
positive,too sincere to exploit its subjects and too honest to manipulate its audience .
positive,the saturation bombing of reggio's images and glass' evocative music . . . ultimately leaves viewers with the task of divining meaning .
positive,for all its serious sense of purpose . . . [it] finds a way to lay bare the tragedies of its setting with a good deal of warmth and humor .
positive,"a depressing confirmation of everything those of us who don't object to the description "" unelected "" have suspected all along : george w . bush is an incurious , uncharismatic , overgrown frat boy with a mean streak a mile wide ."
positive,"this road movie gives you emotional whiplash , and you'll be glad you went along for the ride ."
positive,"sure , it's more of the same , but as the film proves , that's not always a bad thing ."
positive,"a lighthearted , feel-good film that embraces the time-honored truth that the most powerful thing in life is love ."
positive,"a bowel-curdling , heart-stopping recipe for terror ."
positive,"daughter from danang is a film that should be seen by all , especially those who aren't aware of , or have forgotten about the unmentioned victims of war ."
positive,"zhang yimou delivers warm , genuine characters who lie not through dishonesty , but because they genuinely believe it's the only way to bring happiness to their loved ones ."
positive,. . . breathes surprising new life into the familiar by amalgamating genres and adding true human complexity to its not-so-stock characters .
positive,"' . . . both hokey and super-cool , and definitely not in a hurry , so sit back , relax and have a few laughs while the little ones get a fuzzy treat . '"
positive,a pleasant romantic comedy .
positive,it's a count for our times .
positive,"greengrass has delivered an undoubted stylistic tour-de-force , and has managed elements such as sound and cinematography with skill"
positive,"smith's point is simple and obvious -- people's homes are extensions of themselves , and particularly eccentric people have particularly eccentric living spaces -- but his subjects are charmers ."
positive,"a romantic comedy , yes , but one with characters who think and talk about their goals , and are working on hard decisions ."
positive,vividly conveys both the pitfalls and the pleasures of over-the-top love .
positive,". . . a weak , manipulative , pencil-thin story that is miraculously able to entertain anyway ."
positive,a pro-fat farce that overcomes much of its excessive moral baggage thanks to two appealing lead performances .
positive,"for the first two-thirds of this sparklingly inventive and artful , always fast and furious tale , kids will go happily along for the ride ."
positive,"majidi's poetic love story is a ravishing consciousness-raiser , if a bit draggy at times ."
positive,the smartest bonehead comedy of the summer .
positive,effectively feeds our senses with the chilling sights and sounds from within the camp to create a completely numbing experience .
positive,i love the way that it took chances and really asks you to take these great leaps of faith and pays off .
positive,"in his debut as a film director , denzel washington delivers a lean and engaging work ."
positive,only two words will tell you what you know when deciding to see it : anthony . hopkins .
positive,"the movie's quiet affirmation of neighborhood values gives it an honest , lived-in glow ."
positive,"a teasing drama whose relentless good-deed/bad-deed reversals are just interesting enough to make a sinner like me pray for an even more interesting , less symmetrical , less obviously cross-shaped creation ."
positive,hayek is stunning as frida and . . . a star-making project .
positive,it's both a necessary political work and a fascinating documentary . . .
positive,"hilarious , acidic brit comedy ."
positive,"as a revenge thriller , the movie is serviceable , but it doesn't really deliver the delicious guilty pleasure of the better film versions ."
positive,an ironic speculation on democracy in a culture unaccustomed to it .
positive,"it's not life-affirming — its vulgar and mean , but i liked it ."
positive,several degrees shy of the gross-out contests one expects from current teen fare .
positive,the inherent strength of the material as well as the integrity of the filmmakers gives this coming-of-age story restraint as well as warmth .
positive,"led by griffin's smartly nuanced performance and enthusiasm , the cast has a lot of fun with the material ."
positive,tuck everlasting achieves a delicate balance of romantic innocence and philosophical depth .
positive,"a gentle blend of present day testimonials , surviving footage of burstein and his family performing , historical archives , and telling stills ."
positive,"a generation x artifact , capturing a brief era of insanity in the sports arena that surely cannot last ."
positive,"possession is elizabeth barrett browning meets nancy drew , and it's directed by . . . neil labute . hmm ."
positive,an uneven but intriguing drama that is part homage and part remake of the italian masterpiece .
positive,windtalkers celebrates the human spirit and packs an emotional wallop .
positive,"having never been a huge fan of dickens' 800-page novel , it surprised me how much pleasure i had watching mcgrath's version ."
positive,"the best thing the film does is to show us not only what that mind looks like , but how the creative process itself operates ."
positive,"for all its failed connections , divine secrets of the ya-ya sisterhood is nurturing , in a gauzy , dithering way ."
positive,this is pretty dicey material . but some unexpected zigs and zags help .
positive,compellingly watchable .
positive,the filmmakers skillfully evoke the sense of menace that nature holds for many urban dwellers .
positive,"the laser-projected paintings provide a spell-casting beauty , while russell and dreyfus are a romantic pairing of hearts , preciously exposed as history corners them ."
positive,you don't have to be an especially tough grader to give a charitable b-minus to the emperor's club .
positive,"this romantic thriller is steeped in the atmosphere of wartime england , and ably captures the speech patterns , moral codes and ideals of the 1940s ."
positive,"divine secrets of the ya-ya sisterhood may not be exactly divine , but it's definitely -- defiantly -- ya ya , what with all of those terrific songs and spirited performances ."
positive,"viewed on its own terms , treasure planet is better-than-average family entertainment , but true fans of the stevenson's novel will likely prefer disney's more faithful 1950 live-action swashbuckling classic ."
positive,"a journey through memory , a celebration of living , and a sobering rumination on fatality , classism , and ignorance ."
positive,resourceful and ingenious entertainment .
positive,""" antwone fisher "" is an earnest , by-the-numbers effort by washington . it won't rock any boats but is solid meat-and-potatoes filmmaking ."
positive,a historical epic with the courage of its convictions about both scope and detail .
positive,"we need [moore's] noisy , cocky energy , his passion and class consciousness ; we need his shticks , we need his stones ."
positive,"although the editing might have been tighter , hush ! sympathetically captures the often futile lifestyle of young people in modern japan ."
positive,"[gai] comes closer to any actress i can remember to personifying independence in its purest and , yes , most intimidating form ."
positive,"these are lives worth watching , paths worth following ."
positive,"it's rather like a lifetime special -- pleasant , sweet and forgettable ."
positive,a moody horror/thriller elevated by deft staging and the director's well-known narrative gamesmanship .
positive,"as a singular character study , it's perfect . it's also the year's sweetest movie ."
positive,"a graceful , contemplative film that gradually and artfully draws us into a world where the personal and the political get fatally intertwined ."
positive,"while not as aggressively impressive as its american counterpart , "" in the bedroom , "" moretti's film makes its own , quieter observations"
positive,the experience of watching blobby old-school cgi animation in this superlarge format is just surreal enough to be diverting .
positive,time changer may not be the most memorable cinema session but its profound self-evaluation message about our fragile existence and the absence of spiritual guidance should at least invade an abundance of mindsets
positive,""" the emperor's new clothes "" begins with a simple plan . . . . well , at least that's the plan ."
positive,haynes has so fanatically fetishized every bizarre old-movie idiosyncrasy with such monastic devotion you're not sure if you should applaud or look into having him committed .
positive,"[director peter] jackson and his crew have so steeped themselves in the majesty of tolkien's writing that every frame produces new joys , whether you're a fan of the books or not ."
positive,"while the glass slipper doesn't quite fit , pumpkin is definitely a unique modern fairytale ."
positive,the drama is played out with such aching beauty and truth that it brings tears to your eyes .
positive,"an exciting and involving rock music doc , a smart and satisfying look inside that tumultuous world ."
positive,"an offbeat , sometimes gross and surprisingly appealing animated film about the true meaning of the holidays ."
positive,this version incarnates the prophetic book in a way even its exacting author might admire .
positive,"sometimes , nothing satisfies like old-fashioned swashbuckling . and in this regard , on guard delivers ."
positive,". . . ambition is in short supply in the cinema , and egoyan tackles his themes and explores his characters' crises with seriousness and compassion ."
positive,"an impossible romance , but we root for the patronized iranian lad ."
positive,"like dickens with his passages , mcgrath crafts quite moving scenes throughout his resolutely dramatic variation on the novel ."
positive,"there's a disreputable air about the whole thing , and that's what makes it irresistible ."
positive,"an exceedingly clever piece of cinema . another great ‘what you don't see' is much more terrifying than what you do see thriller , coupled with some arresting effects , incandescent tones and stupendous performances"
positive,a carefully structured scream of consciousness that is tortured and unsettling--but unquestionably alive .
positive,a quietly reflective and melancholy new zealand film about an eventful summer in a 13-year-old girl's life .
positive,"cute , funny , heartwarming digitally animated feature film with plenty of slapstick humor for the kids , lots of in-jokes for the adults and heart enough for everyone ."
positive,"very solid , very watchable first feature for director peter sheridan"
positive,a budget affair that exposes the generally sad existence of the bedouins while providing a precious twinkle of insight into their lives .
positive,"it suggests the wide-ranging effects of media manipulation , from the kind of reporting that is done by the supposedly liberal media . . . to the intimate and ultimately tragic heartache of maverick individuals like hatfield and hicks ."
positive,"workmanlike , maybe , but still a film with all the elements that made the other three great , scary times at the movies ."
positive,a pleasant enough comedy that should have found a summer place .
positive,"branagh , in his most forceful non-shakespeare screen performance , grounds even the softest moments in the angry revolt of his wit ."
positive,"though the violence is far less sadistic than usual , the film is typical miike : fast , furious and full of off-the-cuff imaginative flourishes ."
positive,"compelling as it is exotic , fast runner has a plot that rivals shakespeare for intrigue , treachery and murder ."
positive,what it lacks in originality it makes up for in intelligence and b-grade stylishness .
positive,the warm presence of zhao benshan makes the preposterous lying hero into something more than he reasonably should be .
positive,"this is as powerful a set of evidence as you'll ever find of why art matters , and how it can resonate far beyond museum walls and through to the most painfully marginal lives ."
positive,director rob marshall went out gunning to make a great one .
positive,skip work to see it at the first opportunity .
positive,bow's best moments are when he's getting busy on the basketball court because that's when he really scores .
positive,offers enough playful fun to entertain the preschool set while embracing a wholesome attitude .
positive,"in the end , punch-drunk love is one of those films that i wanted to like much more than i actually did . sometimes , that's enough ."
positive,"an intimate , good-humored ethnic comedy like numerous others but cuts deeper than expected ."
positive,ice cube holds the film together with an engaging and warm performance . . .
positive,both deeply weird and charmingly dear .
positive,"as blunt as it is in depicting child abuse , el bola is a movie steeped in an ambiguity that lends its conflicts a symbolic resonance ."
positive,"despite a story predictable enough to make the sound of music play like a nail-biting thriller , its heart is so much in the right place it is difficult to get really peeved at it ."
positive,it's a masterpiece .
positive,"an incredibly low-rent danish film , it brings a group of people together in a sweet and charming way , if a little convenient"
positive,"it's the cinematic equivalent of a good page-turner , and even if it's nonsense , its claws dig surprisingly deep ."
positive,director nalin pan doesn't do much to weigh any arguments one way or the other . he simply presents his point of view that ayurveda works . no question .
