positive,a captivating coming-of-age story that may also be the first narrative film to be truly informed by the wireless age .
positive,what could have been a daytime soap opera is actually a compelling look at a young woman's tragic odyssey .
positive,duvall is strong as always .
positive,a no-holds-barred cinematic treat .
positive,you'd have to be a most hard-hearted person not to be moved by this drama .
positive,allen's underestimated charm delivers more goodies than lumps of coal .
positive,"measured against practically any like-themed film other than its oscar-sweeping franchise predecessor the silence of the lambs , red dragon rates as an exceptional thriller ."
positive,an exhilarating serving of movie fluff .
positive,"maelstrom is strange and compelling , engrossing and different , a moral tale with a twisted sense of humor ."
positive,it makes you believe the cast and crew thoroughly enjoyed themselves and believed in their small-budget film .
positive,"dark and disturbing , yet compelling to watch ."
positive,"too often , son of the bride becomes an exercise in trying to predict when a preordained "" big moment "" will occur and not "" if . """
positive,"the picture uses humor and a heartfelt conviction to tell a story about discovering your destination in life , but also acknowledging the places , and the people , from whence you came ."
positive,a solid piece of journalistic work that draws a picture of a man for whom political expedience became a deadly foreign policy .
positive,a terrific insider look at the star-making machinery of tinseltown .
positive,it's a diverting enough hour-and-a-half for the family audience .
positive,a party-hearty teen flick that scalds like acid .
positive,as giddy and whimsical and relevant today as it was 270 years ago .
positive,the film offers an intriguing what-if premise .
positive,the pianist is the film roman polanski may have been born to make .
positive,this version does justice both to stevenson and to the sci-fi genre .
positive,poignant and delicately complex .
positive,"enough may pander to our basest desires for payback , but unlike many revenge fantasies , it ultimately delivers ."
positive,cho's latest comic set isn't as sharp or as fresh as i'm the one that i want . . . but it's still damn funny stuff .
positive,"in the pianist , polanski is saying what he has long wanted to say , confronting the roots of his own preoccupations and obsessions , and he allows nothing to get in the way ."
positive,"despite the film's shortcomings , the stories are quietly moving ."
positive,"those who love cinema paradiso will find the new scenes interesting , but few will find the movie improved ."
positive,"if you come from a family that eats , meddles , argues , laughs , kibbitzes and fights together , then go see this delightful comedy ."
positive,this bracingly truthful antidote to hollywood teenage movies that slather clearasil over the blemishes of youth captures the combustible mixture of a chafing inner loneliness and desperate grandiosity that tend to characterize puberty .
positive,"the reason to see "" sade "" lay with the chemistry and complex relationship between the marquis ( auteil ) and emilie ( le besco ) ."
positive,it's the filmmakers' post-camp comprehension of what made old-time b movies good-bad that makes eight legged freaks a perfectly entertaining summer diversion .
positive,serious and thoughtful .
positive,"it strikes hardest… when it reminds you how pertinent its dynamics remain . fifty years after the fact , the world's political situation seems little different , and [director phillip] noyce brings out the allegory with remarkable skill ."
positive,"the film's strength isn't in its details , but in the larger picture it paints - of a culture in conflict with itself , with the thin veneer of nationalism that covers our deepest , media-soaked fears ."
positive,". . . best seen as speculative history , as much an exploration of the paranoid impulse as a creative sequel to the warren report ."
positive,"it has its faults , but it is a kind , unapologetic , sweetheart of a movie , and mandy moore leaves a positive impression ."
positive,"the saigon of 1952 is an uneasy mix of sensual delights and simmering violence , and the quiet american brings us right into the center of that world ."
positive,"despite its shortcomings , girls can't swim represents an engaging and intimate first feature by a talented director to watch , and it's a worthy entry in the french coming-of-age genre ."
positive,"flawed , but worth seeing for ambrose's performance ."
positive,"with dirty deeds , david caesar has stepped into the mainstream of filmmaking with an assurance worthy of international acclaim and with every cinematic tool well under his control -- driven by a natural sense for what works on screen ."
positive,the humor and humanity of monsoon wedding are in perfect balance .
positive,"lookin' for sin , american-style ? try hell house , which documents the cautionary christian spook-a-rama of the same name ."
positive,a compelling motion picture that illustrates an american tragedy .
positive,"as comedic spotlights go , notorious c . h . o . hits all the verbal marks it should ."
positive,it's a day at the beach -- with air conditioning and popcorn .
positive,"frida isn't that much different from many a hollywood romance . what sets it apart is the vision that taymor , the avant garde director of broadway's the lion king and the film titus , brings ."
positive,"stevens has a flair for dialogue comedy , the film operates nicely off the element of surprise , and the large cast is solid ."
positive,"extremely well acted by the four primary actors , this is a seriously intended movie that is not easily forgotten ."
positive,the film exudes the urbane sweetness that woody allen seems to have bitterly forsaken .
positive,"k-19 : the widowmaker is derivative , overlong , and bombastic -- yet surprisingly entertaining ."
positive,"it's good , hard-edged stuff , violent and a bit exploitative but also nicely done , morally alert and street-smart ."
positive,"cineasts will revel in those visual in-jokes , as in the film's verbal pokes at everything from the likes of miramax chief harvey weinstein's bluff personal style to the stylistic rigors of denmark's dogma movement ."
positive,it's a rare window on an artistic collaboration .
positive,". . . begins with promise , but runs aground after being snared in its own tangled plot ."
positive,perhaps the best sports movie i've ever seen .
positive,cho's timing is priceless .
positive,". . . creates a visceral sense of its characters' lives and conflicted emotions that carries it far above . . . what could have been a melodramatic , lifetime channel-style anthology ."
positive,"a sensitive , moving , brilliantly constructed work ."
positive,an edgy thriller that delivers a surprising punch .
positive,a reasonably entertaining sequel to 1994's surprise family hit that may strain adult credibility .
positive,[reno] delivers a monologue that manages to incorporate both the horror and the absurdity of the situation in a well-balanced fashion .
positive,there is truth here
positive,"a confident , richly acted , emotionally devastating piece of work and 2002's first great film"
positive,"a touching , small-scale story of family responsibility and care in the community ."
positive,arteta directs one of the best ensemble casts of the year
positive,the casting of von sydow . . . is itself intacto's luckiest stroke .
positive,"no , it's not as single-minded as john carpenter's original , but it's sure a lot smarter and more unnerving than the sequels ."
positive,"a gem of a romantic crime comedy that turns out to be clever , amusing and unpredictable ."
positive,"stands as one of the year's most intriguing movie experiences , letting its imagery speak for it while it forces you to ponder anew what a movie can be ."
positive,". . . the first 2/3 of the film are incredibly captivating and insanely funny , thanks in part to interesting cinematic devices ( cool visual backmasking ) , a solid cast , and some wickedly sick and twisted humor . . ."
positive,this movie got me grinning . there's a part of us that cannot help be entertained by the sight of someone getting away with something .
positive,an old-fashioned drama of substance about a teacher's slide down the slippery slope of dishonesty after an encounter with the rich and the powerful who have nothing but disdain for virtue .
positive,"what's not to like about a movie with a 'children's' song that includes the line 'my stepdad's not mean , he's just adjusting' ?"
positive,"this english-language version . . . does full honor to miyazaki's teeming and often unsettling landscape , and to the conflicted complexity of his characters ."
positive,the pleasures that it does afford may be enough to keep many moviegoers occupied amidst some of the more serious-minded concerns of other year-end movies .
positive,"not everyone will welcome or accept the trials of henry kissinger as faithful portraiture , but few can argue that the debate it joins is a necessary and timely one ."
positive,"there are no special effects , and no hollywood endings ."
positive,"like the original , this version is raised a few notches above kiddie fantasy pablum by allen's astringent wit ."
positive,"despite its hawaiian setting , the science-fiction trimmings and some moments of rowdy slapstick , the basic plot of "" lilo "" could have been pulled from a tear-stained vintage shirley temple script ."
positive,a brutally honest documentary about a much anticipated family reunion that goes wrong thanks to culture shock and a refusal to empathize with others .
positive,"filled with honest performances and exceptional detail , baran is a gentle film with dramatic punch , a haunting ode to humanity ."
positive,"sparkles in its deft portrait of tinseltown's seasoned veterans of gossip , wealth , paranoia , and celebrityhood ."
positive,"in its dry and forceful way , it delivers the same message as jiri menzel's closely watched trains and danis tanovic's no man's land ."
positive,one-of-a-kind near-masterpiece .
positive,. . . a triumph of emotionally and narratively complex filmmaking .
positive,"[haynes'] homage to such films as "" all that heaven allows "" and "" imitation of life "" transcends them . simply put , "" far from heaven "" is a masterpiece ."
positive,an intense and effective film about loneliness and the chilly anonymity of the environments where so many of us spend so much of our time .
positive,"although fairly involving as far as it goes , the film doesn't end up having much that is fresh to say about growing up catholic or , really , anything ."
positive,proves mainly that south korean filmmakers can make undemanding action movies with all the alacrity of their hollywood counterparts .
positive,a very funny romantic comedy about two skittish new york middle-agers who stumble into a relationship and then struggle furiously with their fears and foibles .
positive,top-notch action powers this romantic drama .
positive,"beresford nicely mixes in as much humor as pathos to take us on his sentimental journey of the heart . it really is a shame that more won't get an opportunity to embrace small , sweet 'evelyn . '"
positive,"i stopped thinking about how good it all was , and started doing nothing but reacting to it - feeling a part of its grand locations , thinking urgently as the protagonists struggled , feeling at the mercy of its inventiveness , gasping at its visual delights ."
positive,probably the best case for christianity since chesterton and lewis .
positive,"a gently funny , sweetly adventurous film that makes you feel genuinely good , that is to say , entirely unconned by false sentiment or sharp , overmanipulative hollywood practices ."
positive,"would be an unendurable viewing experience for this ultra-provincial new yorker if 26-year-old reese witherspoon were not on hand to inject her pure fantasy character , melanie carmichael , with a massive infusion of old-fashioned hollywood magic ."
positive,"visually fascinating . . . an often intense character study about fathers and sons , loyalty and duty ."
positive,a lyrical metaphor for cultural and personal self-discovery and a picaresque view of a little-remembered world .
positive,schütte's dramatic snapshot of the artist three days before his death offers an interesting bit of speculation as to the issues brecht faced as his life drew to a close .
positive,"a slick , engrossing melodrama ."
positive,"s1m0ne's satire is not subtle , but it is effective . it's a quirky , off-beat project . . . ."
positive,"while some will object to the idea of a vietnam picture with such a rah-rah , patriotic tone , soldiers ultimately achieves its main strategic objective : dramatizing the human cost of the conflict that came to define a generation ."
positive,"even if you don't know the band or the album's songs by heart , you will enjoy seeing how both evolve , and you will also learn a good deal about the state of the music business in the 21st century ."
positive,the solid filmmaking and convincing characters makes this a high water mark for this genre .
positive,"films about loss , grief and recovery are pretty valuable these days . seen in that light , moonlight mile should strike a nerve in many ."
positive,"it's endlessly inventive , consistently intelligent and sickeningly savage ."
positive,it is definitely worth seeing .
positive,an impeccable study in perversity .
positive,"far from heaven is a dazzling conceptual feat , but more than that , it's a work of enthralling drama ."
positive,"a movie that both thrills the eye and , in its over-the-top way , touches the heart ."
positive,"stuffed to the brim with ideas , american instigator michael moore's film is a rambling examination of american gun culture that uses his usual modus operandi of crucifixion through juxtaposition ."
positive,"affectionately reminds us that , in any language , the huge stuff in life can usually be traced back to the little things ."
positive,"a drama of great power , yet some members of the audience will leave the theater believing they have seen a comedy ."
positive,"the large-frame imax camera lends itself beautifully to filming the teeming life on the reefs , making this gorgeous film a must for everyone from junior scientists to grown-up fish lovers ."
positive,"the result is more depressing than liberating , but it's never boring ."
positive,a story about intelligent high school students that deals with first love sweetly but also seriously . it is also beautifully acted .
positive,"it isn't that the picture is unfamiliar , but that it manages to find new avenues of discourse on old problems ."
positive,"same song , second verse , coulda been better , but it coulda been worse ."
positive,"it's a technically superb film , shining with all the usual spielberg flair , expertly utilizing the talents of his top-notch creative team ."
positive,"wilco fans will have a great time , and the movie should win the band a few new converts , too ."
positive,"tsai has a well-deserved reputation as one of the cinema world's great visual stylists , and in this film , every shot enhances the excellent performances ."
positive,the date movie that franz kafka would have made .
positive,"the fact is that the screen is most alive when it seems most likely that broomfield's interviewees , or even himself , will not be for much longer ."
positive,leguizamo and jones are both excellent and the rest of the cast is uniformly superb .
positive,i liked this film a lot . . .
positive,. . . there is enough originality in 'life' to distance it from the pack of paint-by-number romantic comedies that so often end up on cinema screens .
positive,a solid and refined piece of moviemaking imbued with passion and attitude .
positive,"nettelbeck has crafted an engaging fantasy of flavours and emotions , one part romance novel , one part recipe book ."
positive,"with or without the sex , a wonderful tale of love and destiny , told well by a master storyteller"
positive,"on the surface a silly comedy , scotland , pa would be forgettable if it weren't such a clever adaptation of the bard's tragic play ."
positive,"a weird , arresting little ride ."
positive,"a fine film , but it would be a lot better if it stuck to betty fisher and left out the other stories ."
positive,"a first-class road movie that proves you can run away from home , but your ego and all your problems go with you ."
positive,"you might want to take a reality check before you pay the full ticket price to see "" simone , "" and consider a dvd rental instead ."
positive,well cast and well directed - a powerful drama with enough sardonic wit to keep it from being maudlin .
positive,a backstage must-see for true fans of comedy .
positive,"there's back-stabbing , inter-racial desire and , most importantly , singing and dancing ."
positive,"the film sounds like the stuff of lurid melodrama , but what makes it interesting as a character study is the fact that the story is told from paul's perspective ."
positive,"jones . . . makes a great impression as the writer-director of this little $1 . 8 million charmer , which may not be cutting-edge indie filmmaking but has a huge heart ."
positive,"in the disturbingly involving family dysfunctional drama how i killed my father , french director anne fontaine delivers an inspired portrait of male-ridden angst and the emotional blockage that accompanies this human condition"
positive,"below may not mark mr . twohy's emergence into the mainstream , but his promise remains undiminished ."
positive,there's no reason to miss interview with the assassin
positive,happily stays close to the ground in a spare and simple manner and doesn't pummel us with phony imagery or music .
positive,its sheer dynamism is infectious .
positive,"for his first attempt at film noir , spielberg presents a fascinating but flawed look at the near future ."
positive,lightweight but appealing .
positive,it somehow managed to make its way past my crappola radar and find a small place in my heart
positive,"perhaps it's cliche to call the film 'refreshing , ' but it is . 'drumline' shows a level of young , black manhood that is funny , touching , smart and complicated ."
positive,"it does give a taste of the burning man ethos , an appealing blend of counter-cultural idealism and hedonistic creativity ."
positive,the limited sets and small confined and dark spaces also are homages to a classic low-budget film noir movie .
positive,"the movie is well done , but slow ."
positive,"[a] wonderfully loopy tale of love , longing , and voting ."
positive,"the fascination comes in the power of the huston performance , which seems so larger than life and yet so fragile , and in the way the ivan character accepts the news of his illness so quickly but still finds himself unable to react ."
positive,"the last scenes of the film are anguished , bitter and truthful . mr . koshashvili is a director to watch ."
positive,predictable storyline and by-the-book scripting is all but washed away by sumptuous ocean visuals and the cinematic stylings of director john stockwell .
positive,"antwone fisher certainly does the trick of making us care about its protagonist and celebrate his victories but , with few exceptions , it rarely stoops to cheap manipulation or corny conventions to do it ."
positive,"one feels the dimming of a certain ambition , but in its place a sweetness , clarity and emotional openness that recalls the classics of early italian neorealism ."
positive,"it challenges , this nervy oddity , like modern art should ."
positive,"whenever you think you've figured out late marriage , it throws you for a loop ."
positive,the pianist is polanski's best film .
positive,"it is a testament of quiet endurance , of common concern , of reconciled survival ."
positive,"this orange has some juice , but it's far from fresh-squeezed ."
positive,"a sensitive , modest comic tragedy that works as both character study and symbolic examination of the huge economic changes sweeping modern china ."
positive,highly engaging .
positive,"high crimes knows the mistakes that bad movies make and is determined not to make them , and maybe that is nobility of a sort ."
positive,cusack's just brilliant in this .
positive,knows how to make our imagination wonder .
positive,"jae-eun jeong's take care of my cat brings a beguiling freshness to a coming-of-age story with such a buoyant , expressive flow of images that it emerges as another key contribution to the flowering of the south korean cinema ."
positive,"the overall fabric is hypnotic , and mr . mattei fosters moments of spontaneous intimacy ."
positive,"evokes a palpable sense of disconnection , made all the more poignant by the incessant use of cell phones ."
positive,malcolm mcdowell is cool . paul bettany is cool . paul bettany playing malcolm mcdowell ? cool .
positive,"a touching , sophisticated film that almost seems like a documentary in the way it captures an italian immigrant family on the brink of major changes ."
positive,. . . a trashy little bit of fluff stuffed with enjoyable performances and a bewildering sense of self-importance
positive,"an inventive , absorbing movie that's as hard to classify as it is hard to resist ."
positive,"it made me want to get made-up and go see this movie with my sisters . i thought the relationships were wonderful , the comedy was funny , and the love 'real' ."
positive,"( caine ) proves once again he hasn't lost his touch , bringing off a superb performance in an admittedly middling film ."
positive,"bogdanovich puts history in perspective and , via kirsten dunst's remarkable performance , he showcases davies as a young woman of great charm , generosity and diplomacy ."
positive,"this breezy caper movie becomes a soulful , incisive meditation on the way we were , and the way we are ."
positive,a captivating new film .
positive,those who aren't put off by the film's austerity will find it more than capable of rewarding them .
positive,"it's a clear-eyed portrait of an intensely lived time , filled with nervous energy , moral ambiguity and great uncertainties ."
positive,reveals how important our special talents can be when put in service of of others . it also shows how deeply felt emotions can draw people together across the walls that might otherwise separate them .
positive,"with the same sort of good-natured fun found in films like tremors , eight legged freaks is prime escapist fare ."
positive,"a sharp , amusing study of the cult of celebrity ."
positive,the sentimental cliches mar an otherwise excellent film . a powerful performance from mel gibson and a brutal 90-minute battle sequence that does everything but issue you a dog-tag and an m-16 .
positive,"a graceful , moving tribute to the courage of new york's finest and a nicely understated expression of the grief shared by the nation at their sacrifice ."
positive,"a coming-of-age tale from new zealand whose boozy , languid air is balanced by a rich visual clarity and deeply felt performances across the board ."
positive,"made to be jaglomized is the cannes film festival , the annual riviera spree of flesh , buzz , blab and money . the charming result is festival in cannes ."
positive,"if you're looking for something new and hoping for something entertaining , you're in luck ."
positive,"a hugely rewarding experience that's every bit as enlightening , insightful and entertaining as grant's two best films -- four weddings and a funeral and bridget jones's diary ."
positive,a rip-roaring comedy action fest that'll put hairs on your chest .
positive,"if there's no art here , it's still a good yarn -- which is nothing to sneeze at these days ."
positive,"simultaneously heart-breaking and very funny , the last kiss is really all about performances ."
positive,"there is a subversive element to this disney cartoon , providing unexpected fizzability ."
positive,"an unforgettable look at morality , family , and social expectation through the prism of that omnibus tradition called marriage ."
positive,"an enjoyable , if occasionally flawed , experiment ."
positive,miyazaki is one of world cinema's most wondrously gifted artists and storytellers .
positive,"if ayurveda can help us return to a sane regimen of eating , sleeping and stress-reducing contemplation , it is clearly a good thing ."
positive,"meeting , even exceeding expectations , it's the best sequel since the empire strikes back . . . a majestic achievement , an epic of astonishing grandeur and surprising emotional depth ."
positive,"leigh is one of the rare directors who feels acting is the heart and soul of cinema . he allows his cast members to make creative contributions to the story and dialogue . this method almost never fails him , and it works superbly here ."
positive,"poetry in motion captured on film . while it can be a bit repetitive , overall it's an entertaining and informative documentary ."
positive,"directing with a sure and measured hand , [haneke] steers clear of the sensational and offers instead an unflinching and objective look at a decidedly perverse pathology ."
positive,the entire movie establishes a wonderfully creepy mood .
positive,"i found the ring moderately absorbing , largely for its elegantly colorful look and sound ."
positive,"the filmmakers want nothing else than to show us a good time , and in their cheap , b movie way , they succeed ."
positive,amari has dressed up this little parable in a fairly irresistible package full of privileged moments and memorable performances .
positive,"rabbit-proof fence will probably make you angry . but it will just as likely make you weep , and it will do so in a way that doesn't make you feel like a sucker ."
